{
	"repo": [
		{
			"name": "Clinical series IMPACT",
			"manifest_file": "/juno/work/ccs/shared/resources/impact/facets/manifests/impact_facets_manifest_latest.txt.gz",
			"tumor_id_format": "^P-\\d{7}-T\\d+-IM\\d(,P-\\d{7}-T\\d+-IM\\d)*$",
			"counts_file_format": "countsMerged____{sample_id}.dat.gz"
	        }
	],
	"watcher_dir": "/juno/work/ccs/shared/software/refit_watcher/",
	"facets_lib": [
		{
			"version": "0.5.14",
			"lib_path": "/usr/local/lib/R/site-library/facets/"
		}
	],
	"verify_sshfs_mount" : "",
	"r_script_path" : "/usr/local/bin/Rscript",
	"facets_suite_lib": "/usr/local/lib/R/site-library/",
	"facets_suite_run_wrapper": "/usr/bin/facets-suite/run-facets-wrapper.R",
	"facets_qc_script": "/usr/bin/facets-preview/facets_qc/v1.0/facets_fit_qc.R"
}
